{
  "id": "fixture-markets-quote",
  "domain": "markets",
  "title": "Markets",
  "updated_at": "2026-01-01T00:00:00Z",
  "stale": false,
  "stale_reason": "",
  "fixture": true,
  "items": [
    {
      "id": "fixture-quote",
      "title": "Fixture quote",
      "source": "Oriel fixture",
      "source_url": "",
      "observed_at": "2026-01-01T00:00:00Z",
      "row": "quote",
      "fields": {
        "symbol": "FIX",
        "price": 100,
        "change": 1.25,
        "delayed": true
      }
    }
  ]
}
