{
  "id": "fixture-wires-headline",
  "domain": "wires",
  "title": "Wires",
  "updated_at": "2026-01-01T00:00:00Z",
  "stale": false,
  "stale_reason": "",
  "fixture": true,
  "items": [
    {
      "id": "fixture-headline",
      "title": "Fixture headline",
      "source": "Oriel fixture",
      "source_url": "",
      "observed_at": "2026-01-01T00:00:00Z",
      "row": "headline",
      "fields": {
        "desk": "world"
      }
    }
  ]
}
